{
  "schemaVersion": 1,
  "kind": "paper",
  "title": "Import regression paper",
  "durationMinutes": 50,
  "instructions": "Answer all five main questions. Total: 100 marks.",
  "sections": [
    {
      "id": "q1",
      "title": "Question 1",
      "context": "Shared context 1"
    },
    {
      "id": "q2",
      "title": "Question 2",
      "context": "Shared context 2"
    },
    {
      "id": "q3",
      "title": "Question 3",
      "context": "Shared context 3"
    },
    {
      "id": "q4",
      "title": "Question 4",
      "context": "SHARED_WORKLOAD: process A and B; time is in ms."
    },
    {
      "id": "q5",
      "title": "Question 5",
      "context": "Shared context 5"
    }
  ],
  "questions": [
    {
      "id": "q1-1",
      "sectionId": "q1",
      "label": "1.1",
      "type": "true-false",
      "text": "Concept statement 1",
      "answer": [
        "true"
      ],
      "explanation": "Explanation for statement 1",
      "marks": 2
    },
    {
      "id": "q1-2",
      "sectionId": "q1",
      "label": "1.2",
      "type": "true-false",
      "text": "Concept statement 2",
      "answer": [
        "false"
      ],
      "explanation": "Explanation for statement 2",
      "marks": 2
    },
    {
      "id": "q1-3",
      "sectionId": "q1",
      "label": "1.3",
      "type": "true-false",
      "text": "Concept statement 3",
      "answer": [
        "true"
      ],
      "explanation": "Explanation for statement 3",
      "marks": 2
    },
    {
      "id": "q1-4",
      "sectionId": "q1",
      "label": "1.4",
      "type": "true-false",
      "text": "Concept statement 4",
      "answer": [
        "false"
      ],
      "explanation": "Explanation for statement 4",
      "marks": 2
    },
    {
      "id": "q1-5",
      "sectionId": "q1",
      "label": "1.5",
      "type": "true-false",
      "text": "Concept statement 5",
      "answer": [
        "true"
      ],
      "explanation": "Explanation for statement 5",
      "marks": 2
    },
    {
      "id": "q1-6",
      "sectionId": "q1",
      "label": "1.6",
      "type": "true-false",
      "text": "Concept statement 6",
      "answer": [
        "false"
      ],
      "explanation": "Explanation for statement 6",
      "marks": 2
    },
    {
      "id": "q1-7",
      "sectionId": "q1",
      "label": "1.7",
      "type": "true-false",
      "text": "Concept statement 7",
      "answer": [
        "true"
      ],
      "explanation": "Explanation for statement 7",
      "marks": 2
    },
    {
      "id": "q1-8",
      "sectionId": "q1",
      "label": "1.8",
      "type": "true-false",
      "text": "Concept statement 8",
      "answer": [
        "false"
      ],
      "explanation": "Explanation for statement 8",
      "marks": 2
    },
    {
      "id": "q1-9",
      "sectionId": "q1",
      "label": "1.9",
      "type": "true-false",
      "text": "Concept statement 9",
      "answer": [
        "true"
      ],
      "explanation": "Explanation for statement 9",
      "marks": 2
    },
    {
      "id": "q1-10",
      "sectionId": "q1",
      "label": "1.10",
      "type": "true-false",
      "text": "Concept statement 10",
      "answer": [
        "false"
      ],
      "explanation": "Explanation for statement 10",
      "marks": 2
    },
    {
      "id": "q2-1",
      "sectionId": "q2",
      "label": "2.1",
      "type": "short",
      "text": "Explain principle 1",
      "answer": [
        "A valid model explanation."
      ],
      "explanation": "Alternative equivalent wording is accepted.",
      "marks": 5,
      "rubric": "Credit each required idea; accept equivalent valid reasoning."
    },
    {
      "id": "q2-2",
      "sectionId": "q2",
      "label": "2.2",
      "type": "short",
      "text": "Explain principle 2",
      "answer": [
        "A valid model explanation."
      ],
      "explanation": "Alternative equivalent wording is accepted.",
      "marks": 5,
      "rubric": "Credit each required idea; accept equivalent valid reasoning."
    },
    {
      "id": "q2-3",
      "sectionId": "q2",
      "label": "2.3",
      "type": "short",
      "text": "Explain principle 3",
      "answer": [
        "A valid model explanation."
      ],
      "explanation": "Alternative equivalent wording is accepted.",
      "marks": 5,
      "rubric": "Credit each required idea; accept equivalent valid reasoning."
    },
    {
      "id": "q2-4",
      "sectionId": "q2",
      "label": "2.4",
      "type": "short",
      "text": "Explain principle 4",
      "answer": [
        "A valid model explanation."
      ],
      "explanation": "Alternative equivalent wording is accepted.",
      "marks": 5,
      "rubric": "Credit each required idea; accept equivalent valid reasoning."
    },
    {
      "id": "q3-1",
      "sectionId": "q3",
      "label": "3.1",
      "type": "single",
      "text": "Choose the correct result.",
      "choices": [
        {
          "id": "a",
          "text": "Result A"
        },
        {
          "id": "b",
          "text": "Result B"
        }
      ],
      "answer": [
        "b"
      ],
      "explanation": "Result B follows from the shared scenario.",
      "marks": 10
    },
    {
      "id": "q4-1",
      "sectionId": "q4",
      "label": "4.1",
      "type": "table",
      "text": "Fill the process timeline.",
      "table": {
        "rows": [
          "0–1",
          "1–2",
          "2–3",
          "3–4",
          "4–5",
          "5–6",
          "6–7",
          "7–8",
          "8–9",
          "9–10",
          "10–11",
          "11–12",
          "12–13",
          "13–14",
          "14–15",
          "15–16",
          "16–17",
          "17–18",
          "18–19",
          "19–20"
        ],
        "columns": [
          "Process"
        ]
      },
      "answer": [
        "A",
        "A",
        "A",
        "A",
        "A",
        "A",
        "A",
        "A",
        "A",
        "A",
        "B",
        "B",
        "B",
        "B",
        "B",
        "B",
        "B",
        "B",
        "B",
        "B"
      ],
      "explanation": "MODEL_TIMELINE_EXPLANATION",
      "marks": 10,
      "rubric": "TIMELINE_RUBRIC: award half a mark per correct slot."
    },
    {
      "id": "q4-2",
      "sectionId": "q4",
      "label": "4.2",
      "type": "short",
      "text": "Explain the schedule.",
      "answer": [
        "MODEL_SCHEDULE_ANSWER"
      ],
      "explanation": "Explain the scheduling rules.",
      "marks": 10,
      "rubric": "Award partial credit for valid reasoning."
    },
    {
      "id": "q5-1",
      "sectionId": "q5",
      "label": "5.1",
      "type": "short",
      "text": "Explain concurrency case 1",
      "answer": [
        "MODEL_CONCURRENCY_ANSWER"
      ],
      "explanation": "Valid alternate interleavings are acceptable.",
      "marks": 15,
      "rubric": "Credit correct outcomes and their supporting explanation."
    },
    {
      "id": "q5-2",
      "sectionId": "q5",
      "label": "5.2",
      "type": "short",
      "text": "Explain concurrency case 2",
      "answer": [
        "MODEL_CONCURRENCY_ANSWER"
      ],
      "explanation": "Valid alternate interleavings are acceptable.",
      "marks": 15,
      "rubric": "Credit correct outcomes and their supporting explanation."
    }
  ]
}