{
  "schemaVersion": 1,
  "title": "Foundations of curiosity",
  "description": "A 12-question tour of mathematics, computing, and physics.",
  "questions": [
    {
      "id": "math-1",
      "type": "single",
      "text": "What is the derivative of $f(x)=x^2$?",
      "choices": [
        {
          "id": "a",
          "text": "$x$"
        },
        {
          "id": "b",
          "text": "$2x$"
        },
        {
          "id": "c",
          "text": "$x^3$"
        }
      ],
      "answer": [
        "b"
      ],
      "explanation": "The power rule gives $\\frac{d}{dx}x^n=nx^{n-1}$.",
      "topic": "Mathematics",
      "difficulty": "Easy",
      "hint": "Use the power rule."
    },
    {
      "id": "math-2",
      "type": "multiple",
      "text": "Select **all prime numbers**.",
      "choices": [
        {
          "id": "a",
          "text": "2"
        },
        {
          "id": "b",
          "text": "9"
        },
        {
          "id": "c",
          "text": "11"
        },
        {
          "id": "d",
          "text": "15"
        }
      ],
      "answer": [
        "a",
        "c"
      ],
      "explanation": "2 and 11 each have exactly two positive divisors.",
      "topic": "Mathematics",
      "difficulty": "Easy"
    },
    {
      "id": "math-3",
      "type": "true-false",
      "text": "Every square matrix is invertible.",
      "answer": [
        "false"
      ],
      "explanation": "A square matrix is invertible only if its determinant is nonzero.",
      "topic": "Mathematics",
      "difficulty": "Medium"
    },
    {
      "id": "math-4",
      "type": "short",
      "text": "Explain what a definite integral represents geometrically.",
      "answer": [
        "The signed area between a curve and the x-axis over an interval."
      ],
      "explanation": "Regions below the x-axis contribute negative signed area.",
      "topic": "Mathematics",
      "difficulty": "Medium"
    },
    {
      "id": "cs-1",
      "type": "single",
      "text": "What does this JavaScript code return?\n\n```js\n[1, 2, 3].map(x => x * 2)\n```",
      "choices": [
        {
          "id": "a",
          "text": "`[2, 4, 6]`"
        },
        {
          "id": "b",
          "text": "`6`"
        },
        {
          "id": "c",
          "text": "`[1, 2, 3]`"
        }
      ],
      "answer": [
        "a"
      ],
      "explanation": "`map` transforms each element and returns a new array.",
      "topic": "Computing",
      "difficulty": "Easy"
    },
    {
      "id": "cs-2",
      "type": "multiple",
      "text": "Which structures generally support **last in, first out** operations?",
      "choices": [
        {
          "id": "a",
          "text": "Stack"
        },
        {
          "id": "b",
          "text": "FIFO queue"
        },
        {
          "id": "c",
          "text": "Array used with push/pop"
        }
      ],
      "answer": [
        "a",
        "c"
      ],
      "explanation": "Stacks and arrays used with push/pop remove the most recently added element first.",
      "topic": "Computing",
      "difficulty": "Easy"
    },
    {
      "id": "cs-3",
      "type": "true-false",
      "text": "Binary search requires an appropriately sorted search space.",
      "answer": [
        "true"
      ],
      "explanation": "The ordering lets the algorithm discard half of the remaining search space.",
      "topic": "Computing",
      "difficulty": "Easy"
    },
    {
      "id": "cs-4",
      "type": "short",
      "text": "Describe the difference between a process and a thread.",
      "answer": [
        "A process has its own address space; threads within a process share that address space."
      ],
      "explanation": "Processes provide isolation, while threads share process resources but have separate execution state.",
      "topic": "Computing",
      "difficulty": "Medium"
    },
    {
      "id": "physics-1",
      "type": "single",
      "text": "Which is the SI unit of force?",
      "choices": [
        {
          "id": "a",
          "text": "Joule"
        },
        {
          "id": "b",
          "text": "Newton"
        },
        {
          "id": "c",
          "text": "Watt"
        }
      ],
      "answer": [
        "b"
      ],
      "explanation": "One newton is $1\\,\\mathrm{kg}\\,\\mathrm{m}/\\mathrm{s}^2$.",
      "topic": "Physics",
      "difficulty": "Easy"
    },
    {
      "id": "physics-2",
      "type": "multiple",
      "text": "Which quantities are vectors?",
      "choices": [
        {
          "id": "a",
          "text": "Velocity"
        },
        {
          "id": "b",
          "text": "Speed"
        },
        {
          "id": "c",
          "text": "Force"
        },
        {
          "id": "d",
          "text": "Energy"
        }
      ],
      "answer": [
        "a",
        "c"
      ],
      "explanation": "Velocity and force have magnitude and direction. Speed and energy are scalars.",
      "topic": "Physics",
      "difficulty": "Easy"
    },
    {
      "id": "physics-3",
      "type": "true-false",
      "text": "In a vacuum near Earth, objects fall with the same acceleration regardless of mass, neglecting other forces.",
      "answer": [
        "true"
      ],
      "explanation": "Gravitational force and inertia both scale with mass, leaving acceleration independent of mass.",
      "topic": "Physics",
      "difficulty": "Easy"
    },
    {
      "id": "physics-4",
      "type": "short",
      "text": "State the principle of conservation of energy.",
      "answer": [
        "The total energy of an isolated system remains constant, although it may change form."
      ],
      "explanation": "Energy may be transferred or transformed, but it is not created or destroyed in an isolated system.",
      "topic": "Physics",
      "difficulty": "Medium",
      "hint": "Think about an isolated system."
    }
  ]
}